{
  "$schema": "https://softwarecrafters.org/conferences_schema_v2.json",
  "name": "SoCraTes Day Berlin",
  "url": "http://www.socratesday.berlin",
  "code-of-conduct": "http://www.socratesday.berlin",
  "health-policy": "self-test and show result during registration",
  "next-date": {
    "start": "2025-09-13",
    "end": "2025-09-13"
  },
  "location": {
    "city": "Berlin",
    "country": "Germany",
    "coordinates": {
      "lat": 52.50892,
      "lng": 13.42169
    }
  },
  "icon": "icons/socratesdayber.png"
}
