{
  "$schema": "https://softwarecrafters.org/conferences_schema_v2.json",
  "name": "SoCraTes France",
  "url": "https://socrates-fr.github.io/",
  "code-of-conduct": "https://socrates-fr.github.io/#portfolioModal2",
  "next-date": {
    "start": "2026-03-26",
    "end": "2026-03-29"
  },
  "location": {
    "city": "Uchaux",
    "country": "France",
    "coordinates": {
      "lat": 49.26762,
      "lng": 1.89751
    }
  }
}