{
  "$schema": "https://softwarecrafters.org/conferences_schema_v2.json",
  "name": "Software Crafters Unconference Online",
  "url": "http://scunconf.com/",
  "code-of-conduct": "https://scunconf.com/#coc",
  "next-date": {
    "start": "2026-02-06",
    "end": "2026-02-06"
  },
  "location": "virtual"
}