{
  "name": "SoCraTes UK",
  "url": "https://socratesuk.org/",
  "code-of-conduct": "https://socratesuk.org/code_of_conduct.html",
  "next-date": {
    "start": "2026-06-18",
    "end": "2026-06-21"
  },
  "health-policy": "Masks recommended, daily tests mandatory (both provided by us) and air filtering",
  "location": {
    "coordinates": {
      "lat": 51.608682,
      "lng": -1.315764
    }
  },
  "icon": "icons/socrates-uk.png"
}