{
  "$schema": "https://softwarecrafters.org/conferences_schema_v2.json",
  "name": "SoCraTes Day Franconia",
  "url": "http://socrates-day-franken.de/",
  "code-of-conduct": "http://socrates-day-franken.de/",
  "next-date": {
    "start": "2019-09-28",
    "end": "2019-09-28"
  },
  "location": {
    "city": "NÃ¼rnberg",
    "country": "Germany",
    "coordinates": {
      "lat": 49.453445,
      "lng": 11.046401
    }
  }
}