{
  "name": "JAlba",
  "url": "http://jalba.scot/",
  "code-of-conduct": "http://jalba.scot/jalba-code-of-conduct/",
  "location": {
    "city": "Edinburgh",
    "country": "Scotland",
    "coordinates": {
      "lat": 55.9533,
      "lng": -3.188267
    }
  },
  "next-date": {
    "start": "2026-05-14",
    "end": "2026-05-16"
  }
}