{
  "$schema": "https://softwarecrafters.org/conferences_schema_v2.json",
  "name": "SoCraTes Belgium",
  "url": "http://socratesbe.org/",
  "code-of-conduct": "https://confcodeofconduct.com/",
  "next-date": {
    "start": "2025-10-09",
    "end": "2025-10-12"
  },
  "location": {
    "city": "La Roche-En-Ardenne",
    "country": "Belgium",
    "coordinates": { "lat": 50.17952, "lng": 5.58305 }
  }
}
