{
  "$schema": "https://softwarecrafters.org/conferences_schema_v2.json",
  "name": "SoCraTes Austria 2025",
  "url": "https://socrates-conference.at/",
  "code-of-conduct": "https://socrates-conference.at/code-of-conduct/",
  "next-date": {
    "start": "2026-09-25",
    "end": "2026-09-26"
  },
  "location": {
    "city": "Linz",
    "country": "Austria",
    "coordinates": {
      "lat": 48.29074,
      "lng": 14.28827
    }
  }
}
